{"schema_version":1,"collector":"cpython-pre-cache-import-gate-v1","plan_sha256":"sha256:aaaaaaaaaaaaaaaaaaaaaaaaaaaaaaaaaaaaaaaaaaaaaaaaaaaaaaaaaaaaaaaa","events":[{"sequence":0,"module_name":"json.decoder","decision":"admitted"},{"sequence":1,"module_name":"fractions","decision":"denied"}],"evidence_sha256":"sha256:bbbbbbbbbbbbbbbbbbbbbbbbbbbbbbbbbbbbbbbbbbbbbbbbbbbbbbbbbbbbbbbb"}
